{
    "corpus_version": "1.0.0",
    "corpus_id": "corpus:shared-cross-engine/1",
    "specification_version": "1.0-draft.1",
    "authority": {
        "manifest_id": "manifest:semantic-1.0-draft.shared-cross-engine-v1",
        "status": "draft",
        "expectation_source": "specification"
    },
    "profiles": [
        {
            "target_profile": {
                "profile_id": "profile:ecmascript/2024",
                "profile_version": "1.2.0",
                "sha256": "5b012d7b0536610d4496718e6954c8f9ec80c16dde26a18f70663d0275ec333e"
            },
            "execution_adapter": "node-regexp-v1",
            "subject_representation": "utf8-text"
        },
        {
            "target_profile": {
                "profile_id": "profile:pcre2/10.42",
                "profile_version": "1.2.0",
                "sha256": "15e9032404dd934ca060e82fbe47f2af5f0b84a4daf1037c3d607a6ef1c4d051"
            },
            "execution_adapter": "pcre2-ctypes-v1",
            "subject_representation": "utf8-text"
        },
        {
            "target_profile": {
                "profile_id": "profile:pcre2/10.43",
                "profile_version": "1.2.0",
                "sha256": "6b8a974a57d91698fb427e1c5525109deb4e7e481fcf07b79a35de716ccff979"
            },
            "execution_adapter": "pcre2-ctypes-v1",
            "subject_representation": "utf8-text"
        },
        {
            "target_profile": {
                "profile_id": "profile:python-re/3.11",
                "profile_version": "1.3.0",
                "sha256": "5808a05beb86acf1577ab4b10055c65c0ee81eb7a167e1f6762c421e7043b751"
            },
            "execution_adapter": "python-re-v1",
            "subject_representation": "utf8-text"
        },
        {
            "target_profile": {
                "profile_id": "profile:python-re/3.11-bytes",
                "profile_version": "1.1.0",
                "sha256": "0ecba94d8083bf26d97f518aca94c6f2b9e4bbff7f0d0eb960c1fb6317c5fcfa"
            },
            "execution_adapter": "python-re-v1",
            "subject_representation": "ascii-bytes"
        }
    ],
    "coverage": {
        "required_feature_tags": [
            "alternation",
            "anchors.input",
            "anchors.line",
            "assertions.lookahead",
            "assertions.lookbehind.fixed",
            "assertions.lookbehind.variable",
            "backreference",
            "boundary.word",
            "capture.logical",
            "character_class.ascii",
            "character_class.negated",
            "character_class.unicode",
            "diagnostic.malformed",
            "literal",
            "repeat.greedy",
            "repeat.lazy",
            "repeat.possessive",
            "rewrite.atomic_literal_elision",
            "sequence",
            "unicode.case_insensitive",
            "wildcard.include_line_terminators"
        ],
        "required_requirement_tags": [
            "anchors.input_end",
            "anchors.input_start",
            "anchors.line_end",
            "anchors.line_start",
            "assertions.lookahead",
            "assertions.lookbehind.fixed_length",
            "assertions.lookbehind.variable_length",
            "boundaries.word",
            "character_classes.unicode",
            "character_semantics.unicode_scalar",
            "groups.atomic",
            "groups.named_capture",
            "matching.case_insensitive",
            "references.backreference",
            "repetition.lazy",
            "repetition.possessive"
        ],
        "required_rewrite_strategies": ["rewrite.atomic_literal.elide.v1"],
        "required_application_states": [
            "execute",
            "not_applicable",
            "unsupported"
        ],
        "expected_case_count": 20,
        "expected_application_counts": {
            "execute": 88,
            "unsupported": 5,
            "not_applicable": 7
        },
        "case_set_sha256": "68e59086aa62d82b1916c4b79e3e09faeaad6d6777e63779ac62a3e93b0ceebb",
        "vector_set_sha256": "24db1a188de8983bc496ac2d7f139aa60f8d372667dbce63b9445e2d9a393b84"
    },
    "vectors": [
        {
            "case_id": "case:diagnostic/unterminated-group",
            "path": "spec/conformance/cases/parser-diagnostic.json",
            "sha256": "94d6c18f9812868852883c39531f8e961614486f6ea06278f37b57632153d674",
            "input_kind": "source",
            "features": ["diagnostic.malformed"],
            "requirements": [],
            "rewrite_strategies": [],
            "modes": {
                "case_matching": "not_applicable",
                "operation": "diagnostic"
            },
            "rationale": "Malformed source is a canonical structured diagnostic and has no target execution semantics.",
            "evidence_refs": ["spec/drafts/1.0/README.md"],
            "applications": [
                {
                    "target_profile": {
                        "profile_id": "profile:ecmascript/2024",
                        "profile_version": "1.2.0",
                        "sha256": "5b012d7b0536610d4496718e6954c8f9ec80c16dde26a18f70663d0275ec333e"
                    },
                    "predicate": "exact_profile",
                    "state": "not_applicable",
                    "reason": "Source diagnostic has no target execution semantics."
                },
                {
                    "target_profile": {
                        "profile_id": "profile:pcre2/10.42",
                        "profile_version": "1.2.0",
                        "sha256": "15e9032404dd934ca060e82fbe47f2af5f0b84a4daf1037c3d607a6ef1c4d051"
                    },
                    "predicate": "exact_profile",
                    "state": "not_applicable",
                    "reason": "Source diagnostic has no target execution semantics."
                },
                {
                    "target_profile": {
                        "profile_id": "profile:pcre2/10.43",
                        "profile_version": "1.2.0",
                        "sha256": "6b8a974a57d91698fb427e1c5525109deb4e7e481fcf07b79a35de716ccff979"
                    },
                    "predicate": "exact_profile",
                    "state": "not_applicable",
                    "reason": "Source diagnostic has no target execution semantics."
                },
                {
                    "target_profile": {
                        "profile_id": "profile:python-re/3.11",
                        "profile_version": "1.3.0",
                        "sha256": "5808a05beb86acf1577ab4b10055c65c0ee81eb7a167e1f6762c421e7043b751"
                    },
                    "predicate": "exact_profile",
                    "state": "not_applicable",
                    "reason": "Source diagnostic has no target execution semantics."
                },
                {
                    "target_profile": {
                        "profile_id": "profile:python-re/3.11-bytes",
                        "profile_version": "1.1.0",
                        "sha256": "0ecba94d8083bf26d97f518aca94c6f2b9e4bbff7f0d0eb960c1fb6317c5fcfa"
                    },
                    "predicate": "exact_profile",
                    "state": "not_applicable",
                    "reason": "Source diagnostic has no target execution semantics."
                }
            ]
        },
        {
            "case_id": "case:matching/alternation",
            "path": "spec/conformance/cases/alternation-match.json",
            "sha256": "164a89909bf47cb8dbccc67bae3869f31bd4d5de923b7dc9193843bd60461cf4",
            "input_kind": "semantic",
            "features": ["alternation"],
            "requirements": [],
            "rewrite_strategies": [],
            "modes": {
                "case_matching": "sensitive",
                "operation": "full_match"
            },
            "rationale": "Each branch is authored semantic intent rather than inferred target behavior.",
            "evidence_refs": ["spec/drafts/1.0/README.md"],
            "applications": [
                {
                    "target_profile": {
                        "profile_id": "profile:ecmascript/2024",
                        "profile_version": "1.2.0",
                        "sha256": "5b012d7b0536610d4496718e6954c8f9ec80c16dde26a18f70663d0275ec333e"
                    },
                    "predicate": "exact_profile",
                    "state": "execute",
                    "portability_status": "native",
                    "reason": "The exact profile has an authored native or certified equivalent representation and must execute."
                },
                {
                    "target_profile": {
                        "profile_id": "profile:pcre2/10.42",
                        "profile_version": "1.2.0",
                        "sha256": "15e9032404dd934ca060e82fbe47f2af5f0b84a4daf1037c3d607a6ef1c4d051"
                    },
                    "predicate": "exact_profile",
                    "state": "execute",
                    "portability_status": "native",
                    "reason": "The exact profile has an authored native or certified equivalent representation and must execute."
                },
                {
                    "target_profile": {
                        "profile_id": "profile:pcre2/10.43",
                        "profile_version": "1.2.0",
                        "sha256": "6b8a974a57d91698fb427e1c5525109deb4e7e481fcf07b79a35de716ccff979"
                    },
                    "predicate": "exact_profile",
                    "state": "execute",
                    "portability_status": "native",
                    "reason": "The exact profile has an authored native or certified equivalent representation and must execute."
                },
                {
                    "target_profile": {
                        "profile_id": "profile:python-re/3.11",